review_tokens_stemmed,Sentimen,sentimen,classified_text,tweet_text,sentence_score,max_positive,max_negative,kelas
kirim dan emas cepat banget aman produk sesuai sudah pernah coba dan lumayan bikin jerawat cepat mateng thankyou,Netral,"{'classified_text': 'kirim dan emas [4] cepat [6] banget aman [5] produk sesuai [3] sudah pernah coba dan lumayan [2] bikin jerawat cepat [4] mateng thankyou', 'tweet_text': ' kirim dan emas cepat banget aman produk sesuai sudah pernah coba dan lumayan bikin jerawat cepat mateng thankyou', 'sentence_score': ['kirim dan emas [4] cepat [6] banget aman [5] produk sesuai [3] sudah pernah coba dan lumayan [2] bikin jerawat cepat [4] mateng thankyou'], 'max_positive': 6, 'max_negative': -1, 'kelas': 'positif'}",kirim dan emas [4] cepat [6] banget aman [5] produk sesuai [3] sudah pernah coba dan lumayan [2] bikin jerawat cepat [4] mateng thankyou, kirim dan emas cepat banget aman produk sesuai sudah pernah coba dan lumayan bikin jerawat cepat mateng thankyou,['kirim dan emas [4] cepat [6] banget aman [5] produk sesuai [3] sudah pernah coba dan lumayan [2] bikin jerawat cepat [4] mateng thankyou'],6,-1,positif
bau agak aneh apek dan bau besi seperti dari tempat saya pernah pakai sabun lain yang tanpa bau tapi enggak pernah seperti ini jadi kurang nyaman pakai dan sampai sekarang masih ada,Netral,"{'classified_text': 'bau [-3] agak aneh [-1] apek dan bau [-4] besi seperti [1] dari tempat saya pernah pakai sabun lain yang tanpa bau [4] tapi enggak pernah seperti [1] ini jadi kurang [-2] nyaman [2] pakai dan sampai sekarang masih ada', 'tweet_text': ' bau agak aneh apek dan bau besi seperti dari tempat saya pernah pakai sabun lain yang tanpa bau tapi enggak pernah seperti ini jadi kurang nyaman pakai dan sampai sekarang masih ada', 'sentence_score': ['bau [-3] agak aneh [-1] apek dan bau [-4] besi seperti [1] dari tempat saya pernah pakai sabun lain yang tanpa bau [4] tapi enggak pernah seperti [1] ini jadi kurang [-2] nyaman [2] pakai dan sampai sekarang masih ada'], 'max_positive': 4, 'max_negative': -4, 'kelas': 'netral'}",bau [-3] agak aneh [-1] apek dan bau [-4] besi seperti [1] dari tempat saya pernah pakai sabun lain yang tanpa bau [4] tapi enggak pernah seperti [1] ini jadi kurang [-2] nyaman [2] pakai dan sampai sekarang masih ada, bau agak aneh apek dan bau besi seperti dari tempat saya pernah pakai sabun lain yang tanpa bau tapi enggak pernah seperti ini jadi kurang nyaman pakai dan sampai sekarang masih ada,['bau [-3] agak aneh [-1] apek dan bau [-4] besi seperti [1] dari tempat saya pernah pakai sabun lain yang tanpa bau [4] tapi enggak pernah seperti [1] ini jadi kurang [-2] nyaman [2] pakai dan sampai sekarang masih ada'],4,-4,netral
dari dulu selalu jadi langgan untuk solusi kalau lagi jerawat bulan ini betul lagi breakout dan tidak pikir lama langsung checkout kembali ini holy grail love you kembali rebu,Netral,"{'classified_text': 'dari dulu selalu jadi langgan untuk solusi kalau lagi jerawat bulan ini betul [4] lagi breakout dan tidak pikir lama [-2] langsung checkout kembali [-1] ini holy grail love you kembali [-1] rebu', 'tweet_text': ' dari dulu selalu jadi langgan untuk solusi kalau lagi jerawat bulan ini betul lagi breakout dan tidak pikir lama langsung checkout kembali ini holy grail love you kembali rebu', 'sentence_score': ['dari dulu selalu jadi langgan untuk solusi kalau lagi jerawat bulan ini betul [4] lagi breakout dan tidak pikir lama [-2] langsung checkout kembali [-1] ini holy grail love you kembali [-1] rebu'], 'max_positive': 4, 'max_negative': -2, 'kelas': 'positif'}",dari dulu selalu jadi langgan untuk solusi kalau lagi jerawat bulan ini betul [4] lagi breakout dan tidak pikir lama [-2] langsung checkout kembali [-1] ini holy grail love you kembali [-1] rebu, dari dulu selalu jadi langgan untuk solusi kalau lagi jerawat bulan ini betul lagi breakout dan tidak pikir lama langsung checkout kembali ini holy grail love you kembali rebu,['dari dulu selalu jadi langgan untuk solusi kalau lagi jerawat bulan ini betul [4] lagi breakout dan tidak pikir lama [-2] langsung checkout kembali [-1] ini holy grail love you kembali [-1] rebu'],4,-2,positif
barang sampai dengan selamat packagingnya juga aman moga cocok,Positif,"{'classified_text': 'barang sampai dengan selamat [4] packagingnya juga aman [4] moga cocok [3]', 'tweet_text': ' barang sampai dengan selamat packagingnya juga aman moga cocok', 'sentence_score': ['barang sampai dengan selamat [4] packagingnya juga aman [4] moga cocok [3]'], 'max_positive': 4, 'max_negative': -1, 'kelas': 'positif'}",barang sampai dengan selamat [4] packagingnya juga aman [4] moga cocok [3], barang sampai dengan selamat packagingnya juga aman moga cocok,['barang sampai dengan selamat [4] packagingnya juga aman [4] moga cocok [3]'],4,-1,positif
baru pertama kali coba moga cocok thank you seller,Positif,"{'classified_text': 'baru pertama kali coba moga cocok [3] thank you seller', 'tweet_text': ' baru pertama kali coba moga cocok thank you seller', 'sentence_score': ['baru pertama kali coba moga cocok [3] thank you seller'], 'max_positive': 3, 'max_negative': -1, 'kelas': 'positif'}",baru pertama kali coba moga cocok [3] thank you seller, baru pertama kali coba moga cocok thank you seller,['baru pertama kali coba moga cocok [3] thank you seller'],3,-1,positif
barang sampai dengan selamat,Negatif,"{'classified_text': 'barang sampai dengan selamat [4]', 'tweet_text': ' barang sampai dengan selamat', 'sentence_score': ['barang sampai dengan selamat [4]'], 'max_positive': 4, 'max_negative': -1, 'kelas': 'positif'}",barang sampai dengan selamat [4], barang sampai dengan selamat,['barang sampai dengan selamat [4]'],4,-1,positif
packing rapi dan aman barang sesuai pesan,Netral,"{'classified_text': 'packing rapi [4] dan aman [4] barang sesuai [3] pesan', 'tweet_text': ' packing rapi dan aman barang sesuai pesan', 'sentence_score': ['packing rapi [4] dan aman [4] barang sesuai [3] pesan'], 'max_positive': 4, 'max_negative': -1, 'kelas': 'positif'}",packing rapi [4] dan aman [4] barang sesuai [3] pesan, packing rapi dan aman barang sesuai pesan,['packing rapi [4] dan aman [4] barang sesuai [3] pesan'],4,-1,positif
this moisturizer is seriously game changer love how one bottle could last me months,Netral,"{'classified_text': 'this moisturizer is seriously game changer love how one bottle could last me months', 'tweet_text': ' this moisturizer is seriously game changer love how one bottle could last me months', 'sentence_score': ['this moisturizer is seriously game changer love how one bottle could last me months'], 'max_positive': 1, 'max_negative': -1, 'kelas': 'netral'}",this moisturizer is seriously game changer love how one bottle could last me months, this moisturizer is seriously game changer love how one bottle could last me months,['this moisturizer is seriously game changer love how one bottle could last me months'],1,-1,netral
baru coba pertama kali moga bisa cocok karena reviewnya bagus,Netral,"{'classified_text': 'baru coba pertama kali moga bisa cocok [3] karena reviewnya bagus [4]', 'tweet_text': ' baru coba pertama kali moga bisa cocok karena reviewnya bagus', 'sentence_score': ['baru coba pertama kali moga bisa cocok [3] karena reviewnya bagus [4]'], 'max_positive': 4, 'max_negative': -1, 'kelas': 'positif'}",baru coba pertama kali moga bisa cocok [3] karena reviewnya bagus [4], baru coba pertama kali moga bisa cocok karena reviewnya bagus,['baru coba pertama kali moga bisa cocok [3] karena reviewnya bagus [4]'],4,-1,positif
mantap sesuai moga cocok,Netral,"{'classified_text': 'mantap [4] sesuai [4] moga cocok [3]', 'tweet_text': ' mantap sesuai moga cocok', 'sentence_score': ['mantap [4] sesuai [4] moga cocok [3]'], 'max_positive': 4, 'max_negative': -1, 'kelas': 'positif'}",mantap [4] sesuai [4] moga cocok [3], mantap sesuai moga cocok,['mantap [4] sesuai [4] moga cocok [3]'],4,-1,positif
tadi mau beli diofflinestore tapi mahal banget pas cek dionline store nya cuma karena dapat potong sama lagi flashsale langsung beli,Positif,"{'classified_text': 'tadi mau beli diofflinestore tapi mahal [-4] banget pas cek dionline store nya cuma [-2] karena dapat potong [-1] sama lagi flashsale langsung beli', 'tweet_text': ' tadi mau beli diofflinestore tapi mahal banget pas cek dionline store nya cuma karena dapat potong sama lagi flashsale langsung beli', 'sentence_score': ['tadi mau beli diofflinestore tapi mahal [-4] banget pas cek dionline store nya cuma [-2] karena dapat potong [-1] sama lagi flashsale langsung beli'], 'max_positive': 1, 'max_negative': -4, 'kelas': 'negatif'}",tadi mau beli diofflinestore tapi mahal [-4] banget pas cek dionline store nya cuma [-2] karena dapat potong [-1] sama lagi flashsale langsung beli, tadi mau beli diofflinestore tapi mahal banget pas cek dionline store nya cuma karena dapat potong sama lagi flashsale langsung beli,['tadi mau beli diofflinestore tapi mahal [-4] banget pas cek dionline store nya cuma [-2] karena dapat potong [-1] sama lagi flashsale langsung beli'],1,-4,negatif
terima kasih,Positif,"{'classified_text': 'terima kasih [4]', 'tweet_text': ' terima kasih', 'sentence_score': ['terima kasih [4]'], 'max_positive': 4, 'max_negative': -1, 'kelas': 'positif'}",terima kasih [4], terima kasih,['terima kasih [4]'],4,-1,positif
terima kasih,Netral,"{'classified_text': 'terima kasih [4]', 'tweet_text': ' terima kasih', 'sentence_score': ['terima kasih [4]'], 'max_positive': 4, 'max_negative': -1, 'kelas': 'positif'}",terima kasih [4], terima kasih,['terima kasih [4]'],4,-1,positif
terima kasih tapi tumben enggak ada gift nya,Netral,"{'classified_text': 'terima kasih [4] tapi tumben enggak ada gift nya', 'tweet_text': ' terima kasih tapi tumben enggak ada gift nya', 'sentence_score': ['terima kasih [4] tapi tumben enggak ada gift nya'], 'max_positive': 4, 'max_negative': -1, 'kelas': 'positif'}",terima kasih [4] tapi tumben enggak ada gift nya, terima kasih tapi tumben enggak ada gift nya,['terima kasih [4] tapi tumben enggak ada gift nya'],4,-1,positif
tipe kulit minyak masalah kulit jerawat moga cocok sama rangkai ini terima kasih,Netral,"{'classified_text': 'tipe kulit minyak masalah [-4] kulit jerawat moga cocok [3] sama rangkai ini terima kasih [4]', 'tweet_text': ' tipe kulit minyak masalah kulit jerawat moga cocok sama rangkai ini terima kasih', 'sentence_score': ['tipe kulit minyak masalah [-4] kulit jerawat moga cocok [3] sama rangkai ini terima kasih [4]'], 'max_positive': 4, 'max_negative': -4, 'kelas': 'netral'}",tipe kulit minyak masalah [-4] kulit jerawat moga cocok [3] sama rangkai ini terima kasih [4], tipe kulit minyak masalah kulit jerawat moga cocok sama rangkai ini terima kasih,['tipe kulit minyak masalah [-4] kulit jerawat moga cocok [3] sama rangkai ini terima kasih [4]'],4,-4,netral
telah minggu pakai muka jadi bruntusan enggak tau memang efek samping pakai atau memang enggak cocok,Netral,"{'classified_text': 'telah minggu pakai muka jadi bruntusan enggak tau memang efek samping pakai atau memang enggak cocok [-3]', 'tweet_text': ' telah minggu pakai muka jadi bruntusan enggak tau memang efek samping pakai atau memang enggak cocok', 'sentence_score': ['telah minggu pakai muka jadi bruntusan enggak tau memang efek samping pakai atau memang enggak cocok [-3]'], 'max_positive': 1, 'max_negative': -3, 'kelas': 'negatif'}",telah minggu pakai muka jadi bruntusan enggak tau memang efek samping pakai atau memang enggak cocok [-3], telah minggu pakai muka jadi bruntusan enggak tau memang efek samping pakai atau memang enggak cocok,['telah minggu pakai muka jadi bruntusan enggak tau memang efek samping pakai atau memang enggak cocok [-3]'],1,-3,negatif
bagus,Positif,"{'classified_text': 'bagus [4]', 'tweet_text': ' bagus', 'sentence_score': ['bagus [4]'], 'max_positive': 4, 'max_negative': -1, 'kelas': 'positif'}",bagus [4], bagus,['bagus [4]'],4,-1,positif
kirim cukup cepat dan barang yang kirim sesuai pesan expired datenya dan,Positif,"{'classified_text': 'kirim cukup [3] cepat [5] dan barang yang kirim sesuai [3] pesan expired datenya dan', 'tweet_text': ' kirim cukup cepat dan barang yang kirim sesuai pesan expired datenya dan', 'sentence_score': ['kirim cukup [3] cepat [5] dan barang yang kirim sesuai [3] pesan expired datenya dan'], 'max_positive': 5, 'max_negative': -1, 'kelas': 'positif'}",kirim cukup [3] cepat [5] dan barang yang kirim sesuai [3] pesan expired datenya dan, kirim cukup cepat dan barang yang kirim sesuai pesan expired datenya dan,['kirim cukup [3] cepat [5] dan barang yang kirim sesuai [3] pesan expired datenya dan'],5,-1,positif
cocok kulit saya enggak kering atau tarik kirim cepat mantap,Positif,"{'classified_text': 'cocok [3] kulit saya enggak kering atau tarik kirim cepat [4] mantap [5]', 'tweet_text': ' cocok kulit saya enggak kering atau tarik kirim cepat mantap', 'sentence_score': ['cocok [3] kulit saya enggak kering atau tarik kirim cepat [4] mantap [5]'], 'max_positive': 5, 'max_negative': -1, 'kelas': 'positif'}",cocok [3] kulit saya enggak kering atau tarik kirim cepat [4] mantap [5], cocok kulit saya enggak kering atau tarik kirim cepat mantap,['cocok [3] kulit saya enggak kering atau tarik kirim cepat [4] mantap [5]'],5,-1,positif
lipstik mudah patah saran kalau pakai jangan ulur terlalu panjang,Positif,"{'classified_text': 'lipstik mudah [3] patah saran kalau pakai jangan ulur terlalu panjang [3]', 'tweet_text': ' lipstik mudah patah saran kalau pakai jangan ulur terlalu panjang', 'sentence_score': ['lipstik mudah [3] patah saran kalau pakai jangan ulur terlalu panjang [3]'], 'max_positive': 3, 'max_negative': -1, 'kelas': 'positif'}",lipstik mudah [3] patah saran kalau pakai jangan ulur terlalu panjang [3], lipstik mudah patah saran kalau pakai jangan ulur terlalu panjang,['lipstik mudah [3] patah saran kalau pakai jangan ulur terlalu panjang [3]'],3,-1,positif
barang lengkap packing aman dan rapi belum coba productnya moga cocok tipe kulit normal,Positif,"{'classified_text': 'barang lengkap packing aman [4] dan rapi [4] belum coba productnya moga cocok [3] tipe kulit normal [-1]', 'tweet_text': ' barang lengkap packing aman dan rapi belum coba productnya moga cocok tipe kulit normal', 'sentence_score': ['barang lengkap packing aman [4] dan rapi [4] belum coba productnya moga cocok [3] tipe kulit normal [-1]'], 'max_positive': 4, 'max_negative': -1, 'kelas': 'positif'}",barang lengkap packing aman [4] dan rapi [4] belum coba productnya moga cocok [3] tipe kulit normal [-1], barang lengkap packing aman dan rapi belum coba productnya moga cocok tipe kulit normal,['barang lengkap packing aman [4] dan rapi [4] belum coba productnya moga cocok [3] tipe kulit normal [-1]'],4,-1,positif
baca review nya bagus mudah juga cocok terima kasih bonus pas banget pas lagi butuh,Positif,"{'classified_text': 'baca review nya bagus [4] mudah [4] juga cocok [3] terima kasih [4] bonus [4] pas banget pas lagi butuh', 'tweet_text': ' baca review nya bagus mudah juga cocok terima kasih bonus pas banget pas lagi butuh', 'sentence_score': ['baca review nya bagus [4] mudah [4] juga cocok [3] terima kasih [4] bonus [4] pas banget pas lagi butuh'], 'max_positive': 4, 'max_negative': -1, 'kelas': 'positif'}",baca review nya bagus [4] mudah [4] juga cocok [3] terima kasih [4] bonus [4] pas banget pas lagi butuh, baca review nya bagus mudah juga cocok terima kasih bonus pas banget pas lagi butuh,['baca review nya bagus [4] mudah [4] juga cocok [3] terima kasih [4] bonus [4] pas banget pas lagi butuh'],4,-1,positif
cocok kulit belum pakai jerawat biji di pipi agak radang malam kasih besok sudah mending dan kempes,Netral,"{'classified_text': 'cocok [3] kulit belum pakai jerawat biji di pipi agak radang [-2] malam kasih besok sudah mending dan kempes', 'tweet_text': ' cocok kulit belum pakai jerawat biji di pipi agak radang malam kasih besok sudah mending dan kempes', 'sentence_score': ['cocok [3] kulit belum pakai jerawat biji di pipi agak radang [-2] malam kasih besok sudah mending dan kempes'], 'max_positive': 3, 'max_negative': -2, 'kelas': 'positif'}",cocok [3] kulit belum pakai jerawat biji di pipi agak radang [-2] malam kasih besok sudah mending dan kempes, cocok kulit belum pakai jerawat biji di pipi agak radang malam kasih besok sudah mending dan kempes,['cocok [3] kulit belum pakai jerawat biji di pipi agak radang [-2] malam kasih besok sudah mending dan kempes'],3,-2,positif
benar bagus tapi di aku jatuh bikin bibir agak kering walaupun belum pakai lipstick sudah pakai lipbalm warna pigmented banget merah queennya bagus banget,Netral,"{'classified_text': 'benar [4] bagus [5] tapi di aku jatuh [-3] bikin bibir agak kering walaupun belum pakai lipstick sudah pakai lipbalm warna pigmented banget merah queennya bagus [5] banget', 'tweet_text': ' benar bagus tapi di aku jatuh bikin bibir agak kering walaupun belum pakai lipstick sudah pakai lipbalm warna pigmented banget merah queennya bagus banget', 'sentence_score': ['benar [4] bagus [5] tapi di aku jatuh [-3] bikin bibir agak kering walaupun belum pakai lipstick sudah pakai lipbalm warna pigmented banget merah queennya bagus [5] banget'], 'max_positive': 5, 'max_negative': -3, 'kelas': 'positif'}",benar [4] bagus [5] tapi di aku jatuh [-3] bikin bibir agak kering walaupun belum pakai lipstick sudah pakai lipbalm warna pigmented banget merah queennya bagus [5] banget, benar bagus tapi di aku jatuh bikin bibir agak kering walaupun belum pakai lipstick sudah pakai lipbalm warna pigmented banget merah queennya bagus banget,['benar [4] bagus [5] tapi di aku jatuh [-3] bikin bibir agak kering walaupun belum pakai lipstick sudah pakai lipbalm warna pigmented banget merah queennya bagus [5] banget'],5,-3,positif
exp date masih lama kirim juga cepat dapat diskon lumayan lagi thanks somethinc,Positif,"{'classified_text': 'exp date masih lama [-2] kirim juga cepat [4] dapat diskon lumayan [2] lagi thanks somethinc', 'tweet_text': ' exp date masih lama kirim juga cepat dapat diskon lumayan lagi thanks somethinc', 'sentence_score': ['exp date masih lama [-2] kirim juga cepat [4] dapat diskon lumayan [2] lagi thanks somethinc'], 'max_positive': 4, 'max_negative': -2, 'kelas': 'positif'}",exp date masih lama [-2] kirim juga cepat [4] dapat diskon lumayan [2] lagi thanks somethinc, exp date masih lama kirim juga cepat dapat diskon lumayan lagi thanks somethinc,['exp date masih lama [-2] kirim juga cepat [4] dapat diskon lumayan [2] lagi thanks somethinc'],4,-2,positif
moga cocok di kulit yang sensitif ini karena banyak teman yang rekomen coba ini jadi langsung aku checkout,Positif,"{'classified_text': 'moga cocok [3] di kulit yang sensitif [-2] ini karena banyak teman yang rekomen coba ini jadi langsung aku checkout', 'tweet_text': ' moga cocok di kulit yang sensitif ini karena banyak teman yang rekomen coba ini jadi langsung aku checkout', 'sentence_score': ['moga cocok [3] di kulit yang sensitif [-2] ini karena banyak teman yang rekomen coba ini jadi langsung aku checkout'], 'max_positive': 3, 'max_negative': -2, 'kelas': 'positif'}",moga cocok [3] di kulit yang sensitif [-2] ini karena banyak teman yang rekomen coba ini jadi langsung aku checkout, moga cocok di kulit yang sensitif ini karena banyak teman yang rekomen coba ini jadi langsung aku checkout,['moga cocok [3] di kulit yang sensitif [-2] ini karena banyak teman yang rekomen coba ini jadi langsung aku checkout'],3,-2,positif
belum coba moga cocok,Netral,"{'classified_text': 'belum coba moga cocok [3]', 'tweet_text': ' belum coba moga cocok', 'sentence_score': ['belum coba moga cocok [3]'], 'max_positive': 3, 'max_negative': -1, 'kelas': 'positif'}",belum coba moga cocok [3], belum coba moga cocok,['belum coba moga cocok [3]'],3,-1,positif
paket aman moga cocok,Positif,"{'classified_text': 'paket aman [4] moga cocok [3]', 'tweet_text': ' paket aman moga cocok', 'sentence_score': ['paket aman [4] moga cocok [3]'], 'max_positive': 4, 'max_negative': -1, 'kelas': 'positif'}",paket aman [4] moga cocok [3], paket aman moga cocok,['paket aman [4] moga cocok [3]'],4,-1,positif
tipe kulit minyak tipe kulit kering tipe kulit normal tipe kulit kombinasi tipe kulit sensitif masalah kulit jerawat,Netral,"{'classified_text': 'tipe kulit minyak tipe kulit kering tipe kulit normal [-1] tipe kulit kombinasi tipe kulit sensitif [-2] masalah [-5] kulit jerawat', 'tweet_text': ' tipe kulit minyak tipe kulit kering tipe kulit normal tipe kulit kombinasi tipe kulit sensitif masalah kulit jerawat', 'sentence_score': ['tipe kulit minyak tipe kulit kering tipe kulit normal [-1] tipe kulit kombinasi tipe kulit sensitif [-2] masalah [-5] kulit jerawat'], 'max_positive': 1, 'max_negative': -5, 'kelas': 'negatif'}",tipe kulit minyak tipe kulit kering tipe kulit normal [-1] tipe kulit kombinasi tipe kulit sensitif [-2] masalah [-5] kulit jerawat, tipe kulit minyak tipe kulit kering tipe kulit normal tipe kulit kombinasi tipe kulit sensitif masalah kulit jerawat,['tipe kulit minyak tipe kulit kering tipe kulit normal [-1] tipe kulit kombinasi tipe kulit sensitif [-2] masalah [-5] kulit jerawat'],1,-5,negatif
kirim cepat packing bagus,Positif,"{'classified_text': 'kirim cepat [4] packing bagus [4]', 'tweet_text': ' kirim cepat packing bagus', 'sentence_score': ['kirim cepat [4] packing bagus [4]'], 'max_positive': 4, 'max_negative': -1, 'kelas': 'positif'}",kirim cepat [4] packing bagus [4], kirim cepat packing bagus,['kirim cepat [4] packing bagus [4]'],4,-1,positif
sesuai dengan deskripsi,Positif,"{'classified_text': 'sesuai [3] dengan deskripsi', 'tweet_text': ' sesuai dengan deskripsi', 'sentence_score': ['sesuai [3] dengan deskripsi'], 'max_positive': 3, 'max_negative': -1, 'kelas': 'positif'}",sesuai [3] dengan deskripsi, sesuai dengan deskripsi,['sesuai [3] dengan deskripsi'],3,-1,positif
ingredients nya bikin penasaran jadi pengin coba jauh ini selalu repurchase produk avo dan selalu cocok aaaa,Positif,"{'classified_text': 'ingredients nya bikin penasaran jadi pengin coba jauh [-2] ini selalu repurchase produk avo dan selalu cocok [3] a [2]', 'tweet_text': ' ingredients nya bikin penasaran jadi pengin coba jauh ini selalu repurchase produk avo dan selalu cocok a', 'sentence_score': ['ingredients nya bikin penasaran jadi pengin coba jauh [-2] ini selalu repurchase produk avo dan selalu cocok [3] a [2]'], 'max_positive': 3, 'max_negative': -2, 'kelas': 'positif'}",ingredients nya bikin penasaran jadi pengin coba jauh [-2] ini selalu repurchase produk avo dan selalu cocok [3] a [2], ingredients nya bikin penasaran jadi pengin coba jauh ini selalu repurchase produk avo dan selalu cocok a,['ingredients nya bikin penasaran jadi pengin coba jauh [-2] ini selalu repurchase produk avo dan selalu cocok [3] a [2]'],3,-2,positif
kirim lama banget tolong ganti kurir,Negatif,"{'classified_text': 'kirim lama [-3] banget tolong ganti kurir', 'tweet_text': ' kirim lama banget tolong ganti kurir', 'sentence_score': ['kirim lama [-3] banget tolong ganti kurir'], 'max_positive': 1, 'max_negative': -3, 'kelas': 'negatif'}",kirim lama [-3] banget tolong ganti kurir, kirim lama banget tolong ganti kurir,['kirim lama [-3] banget tolong ganti kurir'],1,-3,negatif
emas oke moga cocok,Positif,"{'classified_text': 'emas [4] oke [4] moga cocok [3]', 'tweet_text': ' emas oke moga cocok', 'sentence_score': ['emas [4] oke [4] moga cocok [3]'], 'max_positive': 4, 'max_negative': -1, 'kelas': 'positif'}",emas [4] oke [4] moga cocok [3], emas oke moga cocok,['emas [4] oke [4] moga cocok [3]'],4,-1,positif
ok moga cocok,Netral,"{'classified_text': 'ok [1] moga cocok [3]', 'tweet_text': ' ok moga cocok', 'sentence_score': ['ok [1] moga cocok [3]'], 'max_positive': 3, 'max_negative': -1, 'kelas': 'positif'}",ok [1] moga cocok [3], ok moga cocok,['ok [1] moga cocok [3]'],3,-1,positif
